{
  "schema_version": "1.0.0",
  "protocol_version": "1.0.0",
  "work_package_id": "WP-0A-A0-001",
  "agent_run_id": "/root/a1_bastion",
  "status": "review_approved",
  "base_revision": "3c8e02589fd5436e8688f3a17a142f3ba7cf5360",
  "branch_or_worktree": "agent/root/WP-0A-A0-001-repository-bootstrap",
  "started_at": "2026-08-31T04:07:16+07:00",
  "updated_at": "2026-08-31T04:07:16+07:00",
  "completed_task_ids": [
    "REP-00-independent-review",
    "REP-00-security-review",
    "REP-00-author-handoff-amendment-review"
  ],
  "current_task_id": "REP-00-reviewer-security-status-record",
  "files_changed": [
    "evidence/WP-0A-A0-001/review-security-verdict.md",
    "evidence/WP-0A-A0-001/status-reviewer-security.json"
  ],
  "contracts_consumed": ["CTR-TEN-001", "CTR-ERR-001", "CTR-EVT-001", "CTR-JOB-001"],
  "contracts_proposed_or_changed": [],
  "tests_run": [
    {
      "command": "git diff --check && git diff --cached --check",
      "result": "pass",
      "exit_code": 0,
      "scope": "committed bootstrap candidate"
    },
    {
      "command": "Node-only repository secret scan and all-work-package validation",
      "result": "pass",
      "exit_code": 0,
      "scope": "synthetic-only candidate"
    },
    {
      "command": "GitHub Actions: Bootstrap validation",
      "result": "success",
      "head_revision": "3c8e02589fd5436e8688f3a17a142f3ba7cf5360",
      "url": "https://github.com/ThinkBizLab-Org/ThinkBizThai/actions/runs/33335381144",
      "job": "bootstrap",
      "duration_seconds": 21,
      "project_runtime": "Node.js 24.20.0 / npm 11.19.0"
    },
    {
      "command": "GitHub Actions action-runtime annotation",
      "result": "non-fatal annotation",
      "detail": "Node.js 20 is deprecated; the pinned checkout and setup-node actions were forced to run on Node.js 24. The workflow still passed with the declared project runtime."
    }
  ],
  "open_risks": [
    "The deterministic scanner covers documented common secret patterns only and does not replace secret management or platform controls.",
    "RFC-2026-001 and OPEN-018 remain in review; this status does not approve either decision."
  ],
  "blockers": [
    "P0 self-package acceptance still requires Product Owner plus A1-A6 representative review and a recorded successful cross-vendor protocol dry run.",
    "Protected CI and branch protection require an authorized repository administrator.",
    "G0 remains Specification Baseline Complete / External Verification Pending, with the documented external product, Meta, Stripe, legal/PDPA, usability, qualified-reviewer, and storage-drill evidence still open."
  ],
  "next_action": "Keep the work-package manifest in_review. Integration/Product owners must close the remaining P0 acceptance and G0 evidence through their independent records; do not infer G0 approval from this reviewer/security status."
}
